{
    "person_id": "585044f5-1272-4bca-8d41-8440eefe7d26",
    "employee_id": "7488a646-e31f-11e4-aace-600308960662",
    "division_id": "b075f148-7f93-4fc2-b2ec-2d81b19a9b7b",
    "created_at": "2020-09-22",
    "started_at": "2020-09-22",
    "ended_at": "2020-10-22",
    "dispense_valid_from": "2020-09-25",
    "dispense_valid_to": "2020-10-25",
    "medication_id": "1349a693-4db1-4a3f-9ac6-8c2f9e541982",
    "medication_qty": 10,
    "medical_program_id": "1349a693-4db1-4a3f-9ac6-8c2f9e541981"
}
